"ID","CAMP_NAME","CATE1","CATE2","CATE3","SIDO_NAME","SIGUGUN_NAME","EUPMYUNDONG_NAME","RY_NAME","BUNJI_NAME","ROAD_NAME","BUILDING_NUM","LATITUDE","LONGITUDE","ZIP","ROAD_ADDRESS","JIBUN_ADDRESS","PHONE","HOMEPAGE","VENDOR","WEEKDAY_OP_STATUS","WEEKEND_OP_STATUS","SPRING_OP_STATUS","SUMMER_OP_STATUS","FALL_OP_STATUS","WINTER_OP_STATUS","FACIL_ELECTRICITY","FACIL_HOT_WATER","FACIL_WIFI","FACIL_CAMPFIRE","FACIL_TRAIL","FACIL_POOL","FACIL_PLAYGROUND","FACIL_MART","FACIL_RESTROOM","FACIL_SHOWERROOM","FACIL_SINK","FACIL_EXTINGUISHER","SURR_FACIL_FISHING","SURR_FACIL_TRAIL","SURR_FACIL_BEACH","SURR_FACIL_MARITIME_LEISURE","SURR_FACIL_VALLEY","SURR_FACIL_STREAM","SURR_FACIL_POOL","SURR_FACIL_YOUTH_EXPERIENCE","SURR_FACIL_RURAL_EXPERIENCE","SURR_FACIL_CHILDRENS_PLAY","GLAM_BED","GLAM_TV","GLAM_FREEZER","GLAM_INTERNET","GLAM_RESTROOM","GLAM_AIRCON","GLAM_HEATER","GLAM_COOKWARE","FACIL_CHARACTERISTICS","FACIL_DETAIL","REG_DATE","LOCATION","BOX_PHOTO_IMAGES","CAMP_INTRO_IMAGES"
6808,"주식회사 클럽 프라비다","여가활동","캠핑","일반야영장","경기도","포천시","이동면","도평리","572-3 번지","금강로","6531 번",38.1079,127.3968,"11110","경기도 포천시 이동면 금강로 6531","경기도 포천시 이동면 도평리 572-3","031-536-8868","정보없음","민간","평일 미운영","주말 운영","봄 운영","여름 운영","가을 운영","겨울 운영","전기 사용가능","온수 사용가능","wifi 사용가능","장작판매","산책로 없음","물놀이장 미보유","놀이터 미보유","마트 없음","1","1","2","6","낚시 시설없음","시설 주변 산책로 있음","시설 주변 물놀이(해수욕장) 없음","시설 주변 물놀이(수상레저) 없음","시설 주변 물놀이(계곡) 없음","시설 주변 물놀이(강) 없음","시설 주변 물놀이(수영장) 없음","시설 주변 물놀이(청소년체험시설) 있음","시설 주변 물놀이(농어촌체험시설) 없음","시설 주변 물놀이(어린이놀이시설) 없음","글램핑 침대 미보유","글램핑 TV 미보유","글램핑 냉장고 미보유","글램핑 유무선 인터넷 미보유","글램핑 내부화장실 미보유","글램핑 에어컨 미보유","글램핑 난방기 미보유","글램핑 취사도구 미보유","각흘산 계곡 최상류에 위치 / 최신설비완비  정자, 골프연습가능     대형견4마리 있음   럭셔리힐링컨셉 (금주금연힐링캠프)  ","최신 트렌드에 맞게 시설도 설비도 모두 새롭게 바꿨다. 도로 멀리서부터 깔끔한 울타리가 둘러쳐져 시선을 사로잡는 이곳은 입구부터 여러 마리 대형견들이 삼엄한 경비를 서 마치 부잣집 별장에 들어서는 기분을 안겨준다. 계단식 잔디 사이트로 구성된 캠핑장 옆으로 작은 계곡물이 흐르고, 캠핑 관리동이 모든 사이트를 내려다보듯 가장 높은 곳에 위치해있다.     관리동의 거실은 캠핑 이용객이라면 모두가 공유할 수 있는 공간으로 카페시설과 휴식을 취할 수 있는 푹신한 소파와 도서들을 구비했다. 포천지역에서 가장 특별한 변화를 추구한 이곳의 가장 큰 특징은 골프연습시설이 갖춰져 이용객들이 원 없이 골프 연습할 수 있다는 것으로, 다른 동일한 캠핑장 서비스에 한층 추가된 럭셔리 혜택이라 할 수 있다.    힐링캠핑을 추구하는 GTF힐링파크의 이념은 ‘금연‘, ‘금주‘이다. ’오직 캠핑만을 즐기며 자연에 심취하자.‘ 라는 건강한 가치관을 내건 곳으로 이곳에서 술과 담배는 절대 금한다. 또한 관광농원의 특징도 함께 갖고 있어 아로니아 수확철이 되면 보랏빛 열매를 수확해볼 수 있다. 캠핑장 이용객들이라면 모든 시설을 원 없이 사용할 수 있으니 제대로 즐겨보고 싶다면 GTF 힐링파크를 권한다. ","2024-05-09",,"",""
6821,"중미산 자연휴양림","여가활동","캠핑","일반야영장","경기도","양평군","옥천면","신복리","201-2 번지","중미산로","1152 번",37.588,127.4546,"12505","경기도 양평군 옥천면 중미산로 1152","경기도 양평군 옥천면 신복리 산 201-2","031-771-1766","정보없음","지자체","평일 운영","주말 운영","봄 운영","여름 운영","가을 운영","겨울 운영","전기 사용불가","온수 사용불가","wifi 사용불가","장작 미판매","산책로 있음","물놀이장 미보유","놀이터 미보유","마트 없음","1","1","0","0","낚시 시설없음","시설 주변 산책로 없음","시설 주변 물놀이(해수욕장) 없음","시설 주변 물놀이(수상레저) 없음","시설 주변 물놀이(계곡) 없음","시설 주변 물놀이(강) 없음","시설 주변 물놀이(수영장) 없음","시설 주변 물놀이(청소년체험시설) 없음","시설 주변 물놀이(농어촌체험시설) 없음","시설 주변 물놀이(어린이놀이시설) 없음","글램핑 침대 미보유","글램핑 TV 미보유","글램핑 냉장고 미보유","글램핑 유무선 인터넷 미보유","글램핑 내부화장실 미보유","글램핑 에어컨 미보유","글램핑 난방기 미보유","글램핑 취사도구 미보유","주차, 예약, 남/녀 화장실 구분","휴양림에는 양평, 설악 일대의 특산물인 표고버섯 재배장이 있으며 유실수를 직접 기르는 과수원, 자연관찰원 등과 숲속의 집, 야영장을 비롯해서 삼림욕장, 산책로, 향토식물원, 물놀이장, 체력단련시설, 어린이놀이터 등이 갖추어져 있다","2024-05-09",,"",""
6822,"중바위캠핑장","여가활동","캠핑","자동차야영장","경기도","가평군","북면","제령리","218-4 번지","제령아랫말길","70 번",37.8877,127.5385,"12405","경기도 가평군 북면 제령아랫말길 70","경기도 가평군 북면 제령리 218-4","031-581-8000","http://cafe.naver.com/jbwcamping","민간","평일 운영","주말 운영","봄 운영","여름 운영","가을 운영","겨울 미운영","전기 사용가능","온수 사용가능","wifi 사용가능","장작판매","산책로 없음","물놀이장 미보유","놀이터 미보유","마트 없음","9","6","7","30","낚시 시설없음","시설 주변 산책로 없음","시설 주변 물놀이(해수욕장) 없음","시설 주변 물놀이(수상레저) 없음","시설 주변 물놀이(계곡) 없음","시설 주변 물놀이(강) 없음","시설 주변 물놀이(수영장) 없음","시설 주변 물놀이(청소년체험시설) 없음","시설 주변 물놀이(농어촌체험시설) 없음","시설 주변 물놀이(어린이놀이시설) 없음","글램핑 침대 미보유","글램핑 TV 미보유","글램핑 냉장고 미보유","글램핑 유무선 인터넷 미보유","글램핑 내부화장실 미보유","글램핑 에어컨 미보유","글램핑 난방기 미보유","글램핑 취사도구 미보유","나무그늘과 계곡이 예술인 캠핑장, 호젓한 캠핑을 원할때 와도 좋은 곳","중바위캠핑장은 경기도 가평군 북면에 위치하며 캠핑을 좀 한다는 캠핑마니아들 사이에 좋은 캠핑장으로 익히 잘 알려져 있으며 캠핑장 안으로 차를 댈 수 없게 유도하여 캠핑하는 모습을 어느 곳에서 사진을 찍어도 멋지게 연출되는 캠핑장이다.     캠핑장은 일반 캠핑사이트를 30면(7m×8m)을 구비했으며 10월부터 장박을 운영 중이다. 계곡 바로 옆 우거진 나무숲속에 마련된 캠핑사이트는 무더운 여름 시원한 그늘을 대신해주어 더위를 염려할 필요가 없을 정도이다. 공용화장실 9개와 공용샤워시설 6개, 개수대 7개가 있어 사용자들에게 충분한 여유를 준다.     특히 캠핑장 아래 수량이 풍부한 맑은 물이 흐르는 계곡이 있어 캠핑과 물놀이를 겸해서 할 수 있으며 대체적으로 이용자들 사이에서는 조용하고 깨끗한 캠핑장으로 유명하다. 관리실 겸 매점은 캠핑에 필요한 각종 제품을 구비하여 캠퍼의 준비 소홀을 보조해준다. ","2024-05-09",,"",""
6828,"지내울 야영장","여가활동","캠핑","자동차야영장","경기도","파주시","문산읍","이천리","340-2 번지","","",37.8848,126.835,"10833","","경기도 파주시 문산읍 이천리 340-2","정보없음","http://cafe.naver.com/jinaeulcamp","민간","평일 미운영","주말 운영","봄 운영","여름 운영","가을 운영","겨울 운영","전기 사용가능","온수 사용가능","wifi 사용가능","장작판매","산책로 없음","물놀이장 보유","놀이터 미보유","마트 있음","2","21","1","10","낚시 시설없음","시설 주변 산책로 없음","시설 주변 물놀이(해수욕장) 없음","시설 주변 물놀이(수상레저) 없음","시설 주변 물놀이(계곡) 없음","시설 주변 물놀이(강) 없음","시설 주변 물놀이(수영장) 없음","시설 주변 물놀이(청소년체험시설) 없음","시설 주변 물놀이(농어촌체험시설) 없음","시설 주변 물놀이(어린이놀이시설) 없음","글램핑 침대 미보유","글램핑 TV 미보유","글램핑 냉장고 미보유","글램핑 유무선 인터넷 미보유","글램핑 내부화장실 미보유","글램핑 에어컨 미보유","글램핑 난방기 미보유","글램핑 취사도구 미보유","개인 트레일러 입장가능,반려동물 동반 불가능","파주시 문산읍 이천리의 지내울캠핑장은 도시를 떠나 자연 속에서 힐링을 즐길 수 있는 캠핑장이다. 캠핑장 규모는 그렇게 크지 않다. 자연 그대로의 모습을 간직한 주위 경관이 일품이다.      캠핑사이트는 모두 20개정도. 파쇄석으로 이뤄져 물빠짐이 좋다. 몽골텐트도 갖춰져 있어 텐트를 가져가지 않아도 캠핑을 즐길 수 있다. 지내울캠핑장의 가장 큰 자랑은 바로 수영장이다. 가로세로 10×20m, 길이 80m의 넓은 수영장은 여름철 물놀이장으로 인기다.     캠핑장에는 화장실, 샤워장, 개수대, 매점 등 편의시설이 잘 갖춰져 있다. 온수도 잘 나오고 모든 시설이 깨끗해 이용에 불편은 없다. ","2024-05-09",,"",""
6844,"지지밸리야영장","여가활동","캠핑","자동차야영장","경기도","가평군","설악면","방일리","545-4 번지","유명로","794-46 번",37.6166,127.4922,"12472","경기도 가평군 설악면 유명로 794-46","경기도 가평군 설악면 방일리 545-4","031-585-5885","http://www.ggvalley.co.kr/","민간","평일 운영","주말 운영","봄 운영","여름 운영","가을 운영","겨울 미운영","전기 사용가능","온수 사용가능","wifi 사용가능","장작판매","산책로 없음","물놀이장 보유","놀이터 보유","마트 없음","2","2","8","15","낚시 시설없음","시설 주변 산책로 있음","시설 주변 물놀이(해수욕장) 없음","시설 주변 물놀이(수상레저) 없음","시설 주변 물놀이(계곡) 없음","시설 주변 물놀이(강) 없음","시설 주변 물놀이(수영장) 없음","시설 주변 물놀이(청소년체험시설) 없음","시설 주변 물놀이(농어촌체험시설) 있음","시설 주변 물놀이(어린이놀이시설) 없음","글램핑 침대 미보유","글램핑 TV 미보유","글램핑 냉장고 미보유","글램핑 유무선 인터넷 미보유","글램핑 내부화장실 미보유","글램핑 에어컨 미보유","글램핑 난방기 미보유","글램핑 취사도구 미보유","개인 트레일러 입장가능,반려동물 동반 소형견만 가능","경기도 가평군 설악면 방일리에 위치한 지지밸리캠핑장은 울창한 숲과 맑은 계곡이 흐르고 접근성도 좋아 사시사철 인기가 있는 캠핑장으로 맛집까지 운영 중이어 1석2조의 캠핑장이다.    둥지캠핑장은 과거 유원지였으나 최근 지지옥션 연수원이 자리 잡고 있는 연수원 부지에 함께 있는 캠핑장으로 최근에는 방갈로 형 펜션을 신축하여 이용자들의 선택의 폭을 넓혀주고 있다. 사이트 사이즈는 4m×4m 크기로 20면을 운영 중이며 그늘막이 전체 싸이트에 쳐져 있다. 공용 시설도 최근에 개장하여 깨끗하며 8월 첫째는 토요일 작은 음악회 진행한다.     관리실과 마트를 운영하며 공용시설은 깨끗하게 관리되고 있으며 개인트레일러 카라반 입장도 가능하다. 캠핑장내 소형견 동반이 가능하며 카라반을 포함한  1박 비용은 최고 5만원을 넘지 않는다. 전기, 와이파이, 샤워실 등 기본시설은 완벽하다.","2024-05-09",,"",""
6859,"짱아 야영장","여가활동","캠핑","일반야영장","경기도","남양주시","별내면","용암리","210 번지","용암비루개길","195-50 번",37.7372,127.1289,"12076","경기도 남양주시 별내면 용암비루개길 195-50","경기도 남양주시 별내면 용암리 210","031-842-3434","https://blog.naver.com/ekf20","민간","평일 운영","주말 운영","봄 운영","여름 운영","가을 운영","겨울 운영","전기 사용가능","온수 사용불가","wifi 사용가능","장작판매","산책로 있음","물놀이장 보유","놀이터 보유","마트 없음","2","1","5","16","낚시 시설없음","시설 주변 산책로 없음","시설 주변 물놀이(해수욕장) 없음","시설 주변 물놀이(수상레저) 없음","시설 주변 물놀이(계곡) 없음","시설 주변 물놀이(강) 있음","시설 주변 물놀이(수영장) 없음","시설 주변 물놀이(청소년체험시설) 없음","시설 주변 물놀이(농어촌체험시설) 없음","시설 주변 물놀이(어린이놀이시설) 없음","글램핑 침대 미보유","글램핑 TV 미보유","글램핑 냉장고 미보유","글램핑 유무선 인터넷 미보유","글램핑 내부화장실 미보유","글램핑 에어컨 미보유","글램핑 난방기 미보유","글램핑 취사도구 미보유","주차, 예약, 남/녀 화장실 구분"," 남양주 별내면에 위치한 짱아 야영장은 수도권 어디에서든 가까워 교통체증 없이 갈 수 있는 캠핑장이다. 짱아 야영장의 ‘짱아‘는 잠자리의 옛말이다.   캠핑장이 주도로에서 떨어져 있고 산 중턱에 위치해 있어 산속에서 힐링하는 듯한 호젓함을 누릴 수 있는 곳이다. 제법 높은 산중턱에 위치한 덕분에 캠핑장에서 산 아래를 내려다보는 뷰가 좋은 것이 매력적이다.    캠핑 사이트는 모두 40면 정도. 야외 수영장 바로 옆에도 5개 텐트를 칠 수 있다. 개장한지 얼마 되지 않아서 전반적인 시설이 깨끗하다. 사무동에 매점, 화장실, 샤워장, 개수대, 대피소 등의 부대시설이 갖춰져 있다. 캠핑사이트 옆에 트램플린이 갖춰져 있어 아이들의 놀이터가 된다.   주위 전경을 감상할 수 있는 사무동 옥상은 소규모 단체를 위한 식사장소로 안성맞춤이다. ","2024-05-09",,"",""
6862,"참살이 가족 캠핑장","여가활동","캠핑","자동차야영장","경기도","안성시","보개면","신장리","72-9 번지","신장길","184 번",37.046,127.2726,"17509","경기도 안성시 보개면 신장길 184","경기도 안성시 보개면 신장리 72-9","031-676-1009","정보없음","민간","평일 운영","주말 운영","봄 운영","여름 운영","가을 운영","겨울 운영","전기 사용가능","온수 사용가능","wifi 사용가능","장작판매","산책로 없음","물놀이장 미보유","놀이터 보유","마트 없음","3","2","7","28","낚시 시설없음","시설 주변 산책로 없음","시설 주변 물놀이(해수욕장) 없음","시설 주변 물놀이(수상레저) 없음","시설 주변 물놀이(계곡) 없음","시설 주변 물놀이(강) 없음","시설 주변 물놀이(수영장) 없음","시설 주변 물놀이(청소년체험시설) 없음","시설 주변 물놀이(농어촌체험시설) 없음","시설 주변 물놀이(어린이놀이시설) 없음","글램핑 침대 미보유","글램핑 TV 미보유","글램핑 냉장고 미보유","글램핑 유무선 인터넷 미보유","글램핑 내부화장실 미보유","글램핑 에어컨 미보유","글램핑 난방기 미보유","글램핑 취사도구 미보유","오토캠핑, 체험활동, 자연학습, 반려동물, 카라반","1예약자 1사이트만 예약 가능합니다. 현장에 2팀 이상이 오셔서 함께 모여 있는 것은 불가합니다.","2024-05-09",,"",""
6884,"철이네캠핑장","여가활동","캠핑","자동차야영장","경기도","가평군","설악면","가일리","223 번지","유명산길","79-18 번",37.5942,127.4906,"12473","경기도 가평군 설악면 유명산길 79-18","경기도 가평군 설악면 가일리 223","정보없음","http://www.xn--950b363bqud.kr/","민간","평일 운영","주말 운영","봄 운영","여름 운영","가을 운영","겨울 미운영","전기 사용가능","온수 사용불가","wifi 사용가능","장작판매","산책로 없음","물놀이장 미보유","놀이터 미보유","마트 없음","1","1","0","0","낚시 시설없음","시설 주변 산책로 없음","시설 주변 물놀이(해수욕장) 없음","시설 주변 물놀이(수상레저) 없음","시설 주변 물놀이(계곡) 없음","시설 주변 물놀이(강) 없음","시설 주변 물놀이(수영장) 없음","시설 주변 물놀이(청소년체험시설) 없음","시설 주변 물놀이(농어촌체험시설) 없음","시설 주변 물놀이(어린이놀이시설) 없음","글램핑 침대 미보유","글램핑 TV 미보유","글램핑 냉장고 미보유","글램핑 유무선 인터넷 미보유","글램핑 내부화장실 미보유","글램핑 에어컨 미보유","글램핑 난방기 미보유","글램핑 취사도구 미보유","반려동물 동반 소형견만 가능","철이네오토캠핑장은 경기 가평군 설악면 가일리. 유명산 자연휴양림 정문 앞에 있다. 유명산계곡에 걸린 유명산1교 바로 옆 계곡에 위치하고 있으며 데크, 파쇄석 사이트가 총 9개로 구성되어 있고, 전기, 온수, 화장실, 샤워실, 취사장, 매점 등의 편의시설이 갖춰져 있다. 다만 그 시설들은 다소 오래되어서 수준급은 아니다. 계곡옆쪽에 방갈로 몇 개와 데크 사이트가 놓여있고 안쪽 큰 나무아래로 파쇄석 사이트가 마련되어 있다. 인근에 가볼만한 관광지는 어비계곡, 국립 유명산자연휴양림, 유명산계곡이 있다.","2024-05-09",,"",""
6889,"청계산 골든밸리 가족캠핑장","여가활동","캠핑","일반야영장,글램핑","경기도","성남시 수정구","금토동","","112 번지","달래내로221번길","17-5 번",37.416,127.0782,"13450","경기도 성남시 수정구 달래내로221번길 17-5","경기도 성남시 수정구 금토동 112","정보없음","https://goldenvalleycamping.modoo.at/","민간","평일 운영","주말 운영","봄 운영","여름 운영","가을 운영","겨울 운영","전기 사용가능","온수 사용가능","wifi 사용불가","장작판매","산책로 없음","물놀이장 미보유","놀이터 미보유","마트 없음","6","6","10","18","낚시 시설없음","시설 주변 산책로 없음","시설 주변 물놀이(해수욕장) 없음","시설 주변 물놀이(수상레저) 없음","시설 주변 물놀이(계곡) 없음","시설 주변 물놀이(강) 없음","시설 주변 물놀이(수영장) 없음","시설 주변 물놀이(청소년체험시설) 없음","시설 주변 물놀이(농어촌체험시설) 없음","시설 주변 물놀이(어린이놀이시설) 없음","글램핑 침대 보유","글램핑 TV 보유","글램핑 냉장고 보유","글램핑 유무선 인터넷 보유","글램핑 내부화장실 미보유","글램핑 에어컨 보유","글램핑 난방기 보유","글램핑 취사도구 보유","주차, 예약, 남/녀 화장실 구분","청계산골든밸리캠핑장은 경부고속도로 판교나들목, 서울용인간고속도로 금토나들목과 가깝다. 지도상으로 보면 서울대공원 산 너머이다. 때문에 서울 양재에서도 지척의 거리다. 청계산골든밸리는 글램핑장과 일반야영장 시설로 구분되어 있다.  맨앞에 있는 주차장을 기준으로 아래쪽에 단풍니무존, 위쪽에 이팝나무존과 소나무존, 정면이 관리동과 세면장이 있다. 세면장 안쪽에 글램핑장이 있고 소나무존과 글램핑장 사이에 느티나무존이 있다. 아직은 나무들이 크지 않아 그늘이 적은게 흠이지만 전반적으로 시설이 깨끗하고 사이트간 간격이 넓어 여유있게 야영을 즐길 수 있다.","2024-05-09",,"",""
6921,"청운오토캠핑장","여가활동","캠핑","자동차야영장","경기도","양평군","","가현리","","","",37.5249,127.7288,"12530","","경기도 양평군 청운면 가현리","031-775-1231","www.campingcu.com","지자체","평일 운영","주말 운영","봄 운영","여름 운영","가을 운영","겨울 미운영","전기 사용가능","온수 사용가능","wifi 사용불가","장작판매","산책로 없음","물놀이장 보유","놀이터 보유","마트 없음","2","1","1","30","낚시 시설없음","시설 주변 산책로 없음","시설 주변 물놀이(해수욕장) 없음","시설 주변 물놀이(수상레저) 없음","시설 주변 물놀이(계곡) 없음","시설 주변 물놀이(강) 없음","시설 주변 물놀이(수영장) 없음","시설 주변 물놀이(청소년체험시설) 없음","시설 주변 물놀이(농어촌체험시설) 없음","시설 주변 물놀이(어린이놀이시설) 없음","글램핑 침대 미보유","글램핑 TV 미보유","글램핑 냉장고 미보유","글램핑 유무선 인터넷 미보유","글램핑 내부화장실 미보유","글램핑 에어컨 미보유","글램핑 난방기 미보유","글램핑 취사도구 미보유","농촌체험마을","알수없음","2024-05-09",,"",""
6929,"청평다감캠핑장","여가활동","캠핑","일반야영장","경기도","가평군","청평면","고성리","786-20 번지","호반로","886 번",37.7106,127.482,"12456","경기도 가평군 청평면 호반로 886","경기도 가평군 청평면 고성리 786-20","0507-1442-4789","https://pscamping.modoo.at/","민간","평일 운영","주말 운영","봄 운영","여름 운영","가을 운영","겨울 운영","전기 사용가능","온수 사용불가","wifi 사용가능","장작판매","산책로 없음","물놀이장 보유","놀이터 미보유","마트 없음","3","2","2","5","낚시 시설없음","시설 주변 산책로 없음","시설 주변 물놀이(해수욕장) 없음","시설 주변 물놀이(수상레저) 있음","시설 주변 물놀이(계곡) 없음","시설 주변 물놀이(강) 없음","시설 주변 물놀이(수영장) 없음","시설 주변 물놀이(청소년체험시설) 없음","시설 주변 물놀이(농어촌체험시설) 없음","시설 주변 물놀이(어린이놀이시설) 있음","글램핑 침대 미보유","글램핑 TV 미보유","글램핑 냉장고 미보유","글램핑 유무선 인터넷 미보유","글램핑 내부화장실 미보유","글램핑 에어컨 미보유","글램핑 난방기 미보유","글램핑 취사도구 미보유","반려동물 동반 불가. 가평청평 최고의호수View -캠프통옆 인터라켄 커플캠프","경기도 가평군 청평면 청평호 캠프통아일랜드 앞에 위치한다.  청평호를 낀 내륙으로 인근에 많은 수상레저 업체들이 산재해 있는 곳으로 대중교통(버스운영) 수단으로 접근보다는 자동차를 이용하는 방법을 추천한다. 청평호반 드라이브 코스를 따라 접근이 가능하다.    일반 야영장 7개동을 운영중이다. 캠핑장은 마사토위에 데크가 5동이 있으며 소규모 캠핑장이다. 바로 앞 청평호와 인접하여 야경이 좋다. 캠프파이어와 바비큐를 할 수 있는 별도 공간이 마련되어 있으며 수령이 있는 나무들이 숲을 이루고 있어 기본적인 그늘을 제공해준다. 카페와 팬션을 운영중이며 개별 개수대는 사이트 내에 있으며 화장실 및 샤워실은 팬션동을 이용한다.","2024-05-09",,"",""
