"ID","CAMP_NAME","CATE1","CATE2","CATE3","SIDO_NAME","SIGUGUN_NAME","EUPMYUNDONG_NAME","RY_NAME","BUNJI_NAME","ROAD_NAME","BUILDING_NUM","LATITUDE","LONGITUDE","ZIP","ROAD_ADDRESS","JIBUN_ADDRESS","PHONE","HOMEPAGE","VENDOR","WEEKDAY_OP_STATUS","WEEKEND_OP_STATUS","SPRING_OP_STATUS","SUMMER_OP_STATUS","FALL_OP_STATUS","WINTER_OP_STATUS","FACIL_ELECTRICITY","FACIL_HOT_WATER","FACIL_WIFI","FACIL_CAMPFIRE","FACIL_TRAIL","FACIL_POOL","FACIL_PLAYGROUND","FACIL_MART","FACIL_RESTROOM","FACIL_SHOWERROOM","FACIL_SINK","FACIL_EXTINGUISHER","SURR_FACIL_FISHING","SURR_FACIL_TRAIL","SURR_FACIL_BEACH","SURR_FACIL_MARITIME_LEISURE","SURR_FACIL_VALLEY","SURR_FACIL_STREAM","SURR_FACIL_POOL","SURR_FACIL_YOUTH_EXPERIENCE","SURR_FACIL_RURAL_EXPERIENCE","SURR_FACIL_CHILDRENS_PLAY","GLAM_BED","GLAM_TV","GLAM_FREEZER","GLAM_INTERNET","GLAM_RESTROOM","GLAM_AIRCON","GLAM_HEATER","GLAM_COOKWARE","FACIL_CHARACTERISTICS","FACIL_DETAIL","REG_DATE","LOCATION","BOX_PHOTO_IMAGES","CAMP_INTRO_IMAGES"
6200,"송가네 오가리캠핑장","여가활동","캠핑","일반야영장","경기도","포천시","창수면","오가리","811 번지","전영로1023번길","115 번",38.0231,127.1651,"11133","경기도 포천시 창수면 전영로1023번길 115","경기도 포천시 창수면 오가리 811","정보없음","http://cafe.daum.net/campogari","민간","평일 운영","주말 운영","봄 운영","여름 운영","가을 운영","겨울 운영","전기 사용가능","온수 사용가능","wifi 사용가능","장작판매","산책로 있음","물놀이장 보유","놀이터 보유","마트 있음","1","1","1","60","낚시 시설 있음","시설 주변 산책로 있음","시설 주변 물놀이(해수욕장) 없음","시설 주변 물놀이(수상레저) 없음","시설 주변 물놀이(계곡) 없음","시설 주변 물놀이(강) 있음","시설 주변 물놀이(수영장) 있음","시설 주변 물놀이(청소년체험시설) 없음","시설 주변 물놀이(농어촌체험시설) 없음","시설 주변 물놀이(어린이놀이시설) 있음","글램핑 침대 미보유","글램핑 TV 미보유","글램핑 냉장고 미보유","글램핑 유무선 인터넷 미보유","글램핑 내부화장실 미보유","글램핑 에어컨 미보유","글램핑 난방기 미보유","글램핑 취사도구 미보유","사장님과 자녀분들 모두 음악과 미술을 전공하신 분 들로 아이들을 위한 자체행사(로봇만들기 와 전통놀이 등 과학과 미술이 점목된 융합놀이 등.테마별 숲속도서관 등 계절과 시기에 맞는  문화적 행사(어린이날행사 와 할로윈타피등)부모님과 함께 할 수 있는 공간. 힐링공간인 만큼 부모님이 쉴수있게 아이들한 영화상영~^^.  가마솥을 만들어 주셔서 백숙등 , 낭만적인 시간을 가질 수 있는곳.  6,7,8월 수영장 개장","오가리캠핑장은 한탄강 줄기가 흐르는 곳에 위치하고 있는 펜션과 야영장이 함께 있는 캠핑장이다. 캠핑장 안으로 들어오면 우측으로는 나무 그늘이 있는 강변 사이트, 좌측으로는 운동장 사이트가 있다. 강변 사이트는 영평천이 한 눈에 들어오는 자리로, 시원한 절경에 기암괴석을 덤으로 볼 수 있다.    캠핑장은 파쇄석 사이트로 되어 있으며, 사이트 공간이 널찍해 텐트를 여유롭게 설치할 수 있어 캠핑하는 동안 편안하게 생활할 수 있다. 캠핑장 내에는 아이들을 위한 놀이방과 도서실, 모래놀이터가 있으며 주말 저녁에는 영화상영도 한다. 여름이면 수영장과 강가를 오가며 물놀이를 한다.     아이들의 놀이공간인 트램펄린은 연령별로 2군데로 나누어져 있어 위험하지 않으며 기다리지 않아도 된다. 오가리캠핑장은 아이들을 위한 체험학습이 많은 곳으로도 유명하다. 계절과 시기별로 프로그램이 다양해 아이들이 먼저 캠핑을 준비한다. 겨울방학을 이용해 부모와 함께 장박을 하는 가족도 있다. ","2024-05-09",,"",""
6221,"수목원프로방스 캠핑장","여가활동","캠핑","일반야영장","경기도","포천시","","금동리","","","",37.9314,127.1243,"11137","","경기도 포천시 신북면 금동리","031-535-2500","http://www.treevalley.co.kr/default/","민간","평일 운영","주말 운영","봄 운영","여름 운영","가을 운영","겨울 미운영","전기 사용가능","온수 사용가능","wifi 사용가능","장작판매","산책로 없음","물놀이장 미보유","놀이터 보유","마트 없음","3","3","3","25","낚시 시설없음","시설 주변 산책로 있음","시설 주변 물놀이(해수욕장) 없음","시설 주변 물놀이(수상레저) 없음","시설 주변 물놀이(계곡) 없음","시설 주변 물놀이(강) 없음","시설 주변 물놀이(수영장) 없음","시설 주변 물놀이(청소년체험시설) 없음","시설 주변 물놀이(농어촌체험시설) 없음","시설 주변 물놀이(어린이놀이시설) 없음","글램핑 침대 미보유","글램핑 TV 미보유","글램핑 냉장고 미보유","글램핑 유무선 인터넷 미보유","글램핑 내부화장실 미보유","글램핑 에어컨 미보유","글램핑 난방기 미보유","글램핑 취사도구 미보유","계곡 물놀이, 산책로, 운동시설, 놀이터","수목원프로방스 캠핑장은 소요산과 왕방산 자락에 위치하고 있으며, 100만 그루의 잣나무와 소나무가 우거진 수목원 안에 위치한 캠핑장이다. 힘차게 뿜어져 나오는 피톤치드를 맡으며 건강도 챙기면서 캠핑을 즐기는 일석이조의 캠핑장이다.    수목원프로방스 캠핑장은 계절별로 보여주는 자연 그대로의 모습과 함께 아름답게 주제별로 잘 꾸며진 정원, 그 속의 꾸며져 있는 조각들의 조형물들을 보고 있으면 감탄사가 저절로 나온다. 계절별로 형형색색의 아름다운 꽃들과 새들의 향연은 캠퍼들에게 힐링과 평화로움을 안겨주기에 충분하다.    캠핑장은 잣나무, 자두나무, 돌배나무 등 테마별로 지어진 사이트와 시원한 계곡이 흐르는 계곡사이트 등 자연이 주는 풍요로움이 많은 곳으로 알려져 있다. 맑고 수심이 깊지 않은 계곡물에는 다슬기가 살고 있어 아이들과 함께 자연체험과 물놀이도 할 수 있다. 까르르 소리에 뒤돌아보니 도룡뇽을 잡은 형과 모래무지를 잡은 동생이 하얀 이를 내보이며 웃음 짓고 있다. 우리아이들의 웃음소리가 끈이지 않았던 곳이다. ","2024-05-09",,"",""
6224,"수산아카데미","여가활동","캠핑","일반야영장","경기도","남양주시","수동면","수산리","368 번지","철마산로","316-31 번",37.7191,127.2647,"12027","경기도 남양주시 수동면 철마산로 316-31","경기도 남양주시 수동면 수산리 368","정보없음","susanac.eplus-m.kr/","민간","평일 운영","주말 운영","봄 운영","여름 운영","가을 운영","겨울 미운영","전기 사용가능","온수 사용가능","wifi 사용가능","장작판매","산책로 있음","물놀이장 보유","놀이터 미보유","마트 없음","8","1","2","15","낚시 시설없음","시설 주변 산책로 있음","시설 주변 물놀이(해수욕장) 없음","시설 주변 물놀이(수상레저) 없음","시설 주변 물놀이(계곡) 없음","시설 주변 물놀이(강) 있음","시설 주변 물놀이(수영장) 없음","시설 주변 물놀이(청소년체험시설) 없음","시설 주변 물놀이(농어촌체험시설) 없음","시설 주변 물놀이(어린이놀이시설) 없음","글램핑 침대 미보유","글램핑 TV 미보유","글램핑 냉장고 미보유","글램핑 유무선 인터넷 미보유","글램핑 내부화장실 미보유","글램핑 에어컨 미보유","글램핑 난방기 미보유","글램핑 취사도구 미보유","계곡 물놀이, 산책로, 강/물놀이, 운동시설","경기도 남양주 수동면 수산리에 위치한 수산아카데미오토캠핑장은 울창한 산림과 청정계곡으로 둘러싸인 캠핑장이다. 아카데미란 명칭은 옛날 기업체 연수시설로 이용되었기 때문이다. 캠핑장 곳곳에 나무가 많을 뿐만 아니라 크기도 무척 커서 시원한 그늘을 즐길 수 있다.      수산아카데미오토캠핑장은 A~F까지 총 6종류의 사이트가 있다. 각 사이트마다 자동차를 세우고도 여유공간이 넓어서 여유롭다. 4개 팀이 한번에 들어갈 수 있는 단체팀 사이트도 마련돼 있다.     물이 맑은 계곡이 바로 옆에 위치하고 계곡물을 끌어와서 이용하는 수영장도 마련돼 있어 여름철 물놀이 즐기기 좋다. 수영장 주위의 나무가 크고 울창해서 그늘에서 쉬기에도 좋다. 관리동 뒤편 어린이도서관에는 책이 배치되어 있어 독서를 즐기기 좋다.","2024-05-09",,"",""
6229,"수원산 오토캠핑장","여가활동","캠핑","일반야영장","경기도","포천시","","직두리","","","",37.8655,127.2446,"11155","","경기도 포천시 군내면 직두리","031-535-4308","http://cafe.naver.com/suwonsanautocamping","민간","평일 운영","주말 운영","봄 운영","여름 운영","가을 운영","겨울 운영","전기 사용가능","온수 사용가능","wifi 사용가능","장작판매","산책로 없음","물놀이장 보유","놀이터 보유","마트 있음","1","1","2","35","낚시 시설없음","시설 주변 산책로 있음","시설 주변 물놀이(해수욕장) 없음","시설 주변 물놀이(수상레저) 없음","시설 주변 물놀이(계곡) 없음","시설 주변 물놀이(강) 있음","시설 주변 물놀이(수영장) 없음","시설 주변 물놀이(청소년체험시설) 없음","시설 주변 물놀이(농어촌체험시설) 있음","시설 주변 물놀이(어린이놀이시설) 없음","글램핑 침대 미보유","글램핑 TV 미보유","글램핑 냉장고 미보유","글램핑 유무선 인터넷 미보유","글램핑 내부화장실 미보유","글램핑 에어컨 미보유","글램핑 난방기 미보유","글램핑 취사도구 미보유","계곡 물놀이, 산책로, 강/물놀이, 농어촌체험시설, 운동시설","포천 시내에서 멀지 않은 수원산 기슭에 포근히 안겨 있는, 조용하고 한적한 시골 느낌의 아담한 캠핑장이 있다. 캠핑장 옆으로는 계곡이 흐르고 있어, 아이들과 물고기 잡이와 물놀이하기에 좋다. 수원산 오토캠핑장은 3구역으로 나누어진 사이트(계곡사이트존, 키즈존, 잣나무존)를 가지고 있으며, 파쇄석 27면 과 마사토 13면으로 되어있다. 사이트 간 간격이 여유로워 캠핑하는 동안 편안히 지낼 수 있어 좋다.    아이들의 놀이 천국인 트렘폴린과 두 곳의 모래놀이터가 있어, 자연스럽게 시간 가는 줄 모르고 놀이에 열중한다. 여름이면 계곡과 수영장으로 아이들이 몰려가 즐거운 한때를 보내기에 충분하다. 또한 겨울철이면 뒷동산 산책길로 자연스레 눈썰매장이 만들어져 어른아이 모두 즐거워하는 시간이 온다. 캠핑장 옆으로는 유기농 텃밭이 있어 고추, 상추, 깻잎 등을 먹을 만큼 가져다 먹을 수 있다.     최신시설의 샤워장과 화장실은 24시간 온수 사용이 가능하며, 화장실에는 유아변기가 설치되어 있어   꼬마캠퍼들이 사용하기에 좋다.","2024-05-09",,"",""
6247,"숲속의 정원 캠핑장","여가활동","캠핑","자동차야영장","경기도","가평군","북면","목동리","792-4 번지","가화로","988-50 번",37.8819,127.5506,"12403","경기도 가평군 북면 가화로 988-50","경기도 가평군 북면 목동리 792-4","정보없음","http://laforetbt.kr","민간","평일 운영","주말 운영","봄 운영","여름 운영","가을 운영","겨울 운영","전기 사용가능","온수 사용가능","wifi 사용가능","장작판매","산책로 있음","물놀이장 미보유","놀이터 보유","마트 있음","2","2","4","16","낚시 시설 있음","시설 주변 산책로 없음","시설 주변 물놀이(해수욕장) 없음","시설 주변 물놀이(수상레저) 없음","시설 주변 물놀이(계곡) 없음","시설 주변 물놀이(강) 없음","시설 주변 물놀이(수영장) 없음","시설 주변 물놀이(청소년체험시설) 없음","시설 주변 물놀이(농어촌체험시설) 없음","시설 주변 물놀이(어린이놀이시설) 있음","글램핑 침대 보유","글램핑 TV 미보유","글램핑 냉장고 보유","글램핑 유무선 인터넷 보유","글램핑 내부화장실 미보유","글램핑 에어컨 보유","글램핑 난방기 보유","글램핑 취사도구 미보유","글램핑 사이트 9개동","캠핑장은 글램핑 사이트 9개동(5m×10m)이 천연잔디 광장을 품고 어우러져 있다. 바로 앞에는 가평천이 흐르고 있어 탁 트인 전망을 선사한다. 이곳 캠핑장은 글램핑 사이트 외에도 펜션을 함께 운영 중으로 예전에는 이름을 날리던 펜션이라고 한다. 그만큼 시설도 신경을 썼는지 상당히 고급스런 느낌이다. 사이트간의 가리도 적당히 멀고 전용데크에는 나무가 사이트를 덥고 있어 천연 타프 역할을 한다. 카바나식 글램핑과 티피텐트형 사이트으로 구분되어 있어 각 이용자의 취향에 맞게 선택을 할 수 가있다.     이 캠핑장의 장점인 천연 그라운드를 이용하여 작은 음악회를 위한 라이브 무대가 설치되어 있는 모습이 마치 가평 자라섬에서 열리는 재즈페스티벌의 무대인 것처럼 느껴진다. 최근에는 정크아트로 유명한 작가님의 작품들을 캠핑장내 곳곳에 설치하여 이용고객들은 무료관람이 가능해 기념사진을 남기기에 좋은 장소이다. 수량이 풍부한 맑은 물이 흐르는 가평천이 있어 캠핑과 물놀이를 겸해서 할 수 있다.","2024-05-09",,"",""
6261,"스카이글램핑","여가활동","캠핑","글램핑","경기도","남양주시","","지둔리","","","",37.713,127.2936,"12028","","경기도 남양주시 수동면 지둔리","정보없음","https://cafe.naver.com/skyglamping","민간","평일 운영","주말 운영","봄 운영","여름 운영","가을 운영","겨울 미운영","전기 사용가능","온수 사용가능","wifi 사용가능","장작판매","산책로 없음","물놀이장 보유","놀이터 미보유","마트 없음","2","2","0","10","낚시 시설없음","시설 주변 산책로 없음","시설 주변 물놀이(해수욕장) 없음","시설 주변 물놀이(수상레저) 없음","시설 주변 물놀이(계곡) 없음","시설 주변 물놀이(강) 있음","시설 주변 물놀이(수영장) 없음","시설 주변 물놀이(청소년체험시설) 없음","시설 주변 물놀이(농어촌체험시설) 없음","시설 주변 물놀이(어린이놀이시설) 없음","글램핑 침대 보유","글램핑 TV 미보유","글램핑 냉장고 보유","글램핑 유무선 인터넷 보유","글램핑 내부화장실 미보유","글램핑 에어컨 보유","글램핑 난방기 보유","글램핑 취사도구 미보유","글램핑장. 전화 또는 소설 예약","서울에서 가깝고 공기 좋고 시설 깨끗한 글램핑장을 찾는다면 경기도 남양주 수동계곡 옆에 위치한 스카이글램핑을 추천한다. 인근에 몽골문화촌이나 축령산자연휴양림도 가까워 나들이 하기 좋은 곳이다.     스카이글램핑은 모두 9동의 글램핑으로 이뤄져 있다. 대규모 글램장에 비교하면 규모가 작아 아담한 편이다. 매점을 비롯해 화장실, 샤워실, 트램폴린, 수영장이 잘 갖춰져 있어 연인이나 가족 단체에게도 적합하다. 특히 글램핑 간의 간격이 가까워 소규모 단체 글램핑에도 잘 어울린다.     화장실, 샤워실 관리가 뛰어나 매우 깨끗하다는 인상을 갖게 한다. 샤워실에 샴푸, 린스, 샤워젤이 준비되어 있어 편리하다. 글램핑장 내부에는 침대, 냉장고, 인터넷, 난방기구, 취사도구 등이 갖춰져 있다. TV는 없다.","2024-05-09",,"",""
6268,"스톤밸리캠핑장","여가활동","캠핑","일반야영장","경기도","양주시","봉양동","","154-1 번지","칠봉산로228번길","126-5 번",37.8589,127.0815,"11448","경기도 양주시 칠봉산로228번길 126-5","경기도 양주시 봉양동 154-1","070-4415-2203","http://cafe.naver.com/bongyanstonevalley","민간","평일 운영","주말 운영","봄 운영","여름 운영","가을 운영","겨울 운영","전기 사용가능","온수 사용가능","wifi 사용가능","장작판매","산책로 있음","물놀이장 보유","놀이터 미보유","마트 있음","6","4","1","16","낚시 시설없음","시설 주변 산책로 있음","시설 주변 물놀이(해수욕장) 없음","시설 주변 물놀이(수상레저) 없음","시설 주변 물놀이(계곡) 없음","시설 주변 물놀이(강) 있음","시설 주변 물놀이(수영장) 없음","시설 주변 물놀이(청소년체험시설) 없음","시설 주변 물놀이(농어촌체험시설) 없음","시설 주변 물놀이(어린이놀이시설) 없음","글램핑 침대 미보유","글램핑 TV 미보유","글램핑 냉장고 미보유","글램핑 유무선 인터넷 미보유","글램핑 내부화장실 미보유","글램핑 에어컨 미보유","글램핑 난방기 미보유","글램핑 취사도구 미보유","알수없음","경기도 양주시에 위치한 스톤밸리캠핑장은 칠봉산 끝자락에 위치하여 주변경관이 우수하며, 가족단위의 소규모캠핑을  즐기기 적합한곳으로 찌든 일상에서 벗어나 진정한 healing을 할 수 있는 캠핑장입니다.","2024-05-09",,"",""
6271,"스톤힐 글램핑","여가활동","캠핑","일반야영장,글램핑","경기도","양평군","양평읍","양근리","552-8 번지","양근골안길17번길","2-24 번",37.5006,127.4871,"12546","경기도 양평군 양평읍 양근골안길17번길 2-24","경기도 양평군 양평읍 양근리 552-8","정보없음","www.thestonehill.com","민간","평일 운영","주말 운영","봄 운영","여름 운영","가을 운영","겨울 운영","전기 사용가능","온수 사용가능","wifi 사용가능","장작판매","산책로 없음","물놀이장 보유","놀이터 보유","마트 없음","2","2","0","20","낚시 시설없음","시설 주변 산책로 없음","시설 주변 물놀이(해수욕장) 없음","시설 주변 물놀이(수상레저) 없음","시설 주변 물놀이(계곡) 없음","시설 주변 물놀이(강) 없음","시설 주변 물놀이(수영장) 없음","시설 주변 물놀이(청소년체험시설) 없음","시설 주변 물놀이(농어촌체험시설) 없음","시설 주변 물놀이(어린이놀이시설) 없음","글램핑 침대 보유","글램핑 TV 보유","글램핑 냉장고 보유","글램핑 유무선 인터넷 보유","글램핑 내부화장실 미보유","글램핑 에어컨 보유","글램핑 난방기 보유","글램핑 취사도구 미보유","반려동물 동반 불가능","스톤힐 글램핑은 자연과 노출콘크리트 현대물이 자연스럽게 어우러진 공간으로 , 글램핑장 , 캠핑장 , 펜션 , 그리고 카페 , 온실 , 텃밭 , 토끼장 , 캠프화이어장 , 여름철에는 수영장등의 다양한 체험공간이 있어 온가족이 여유롭고 즐겁게 머물다 갈 수 있는 캠핑리조트이다 . 계절의 변화를 느낄수 있는 잘 가꾸어진 정원에 위치한 글램핑 안에는 편히 쉴수있는 침대 , 식탁 , 소파등의 가구들이 배치되 있고 글램핑 텐트 앞 데크에는 바베큐와 캠프화이어를 즐길수 있는 시설이 구비되 있어 캠핑을 편안하고도 감성적으로 즐길 수 있다 . 깨끗하고 고급스러운 넓은 부대시설을 더해 모든 방문객들에게 내집과 같은 쾌적함과 안정감을 추구하고 있다 . 바쁜 일상을 내려놓고 사랑하는 이들과 진정한 힐링을 나누고 재충전 해 보자 !","2024-05-09",,"",""
6283,"신북온천글램핑장","여가활동","캠핑","글램핑","경기도","포천시","신북면","덕둔리","627-1 번지","청신로","571 번",37.9743,127.1044,"11137","경기도 포천시 신북면 청신로 571","경기도 포천시 신북면 덕둔리 627-1","정보없음","sinbukresort,co.kr","민간","평일 운영","주말 운영","봄 운영","여름 운영","가을 운영","겨울 미운영","전기 사용가능","온수 사용가능","wifi 사용불가","장작판매","산책로 있음","물놀이장 보유","놀이터 보유","마트 있음","1","1","1","16","낚시 시설없음","시설 주변 산책로 있음","시설 주변 물놀이(해수욕장) 없음","시설 주변 물놀이(수상레저) 없음","시설 주변 물놀이(계곡) 없음","시설 주변 물놀이(강) 없음","시설 주변 물놀이(수영장) 있음","시설 주변 물놀이(청소년체험시설) 없음","시설 주변 물놀이(농어촌체험시설) 없음","시설 주변 물놀이(어린이놀이시설) 없음","글램핑 침대 보유","글램핑 TV 미보유","글램핑 냉장고 보유","글램핑 유무선 인터넷 미보유","글램핑 내부화장실 미보유","글램핑 에어컨 보유","글램핑 난방기 보유","글램핑 취사도구 보유","	개인 트레일러 입장가능, 반려동물 동반 불가능","포천 온천명소로 ‘신북 리조트’가 유명하다. 신북온천 글램핑장은 신북리조트에서 관리하는 캠핑장으로 여러 명칭을 거쳐 지금은 ‘신북온천 글램핑장’이라는 이름으로 불린다. 캠핑장보다는 온천이 유명하며 온천과 글램핑을 동시에 즐기고자 하는 여행객들에게 인기가 많다. 글램핑시설은 5m*7m 규모로 비교적 큰 크기를 자랑하며 높이는 3m에 육박한다. 글램핑장 옆으로 주차가 가능하다. 글램핑장 주변으로 넓은 잔디가 있어 뛰어놀기에도 좋다.    이곳은 글램핑장 전용 건물이 있고 체크인&아웃과 화장실, 샤워장, 개수대, 매점 등의 편의시설을 갖췄다. 글램핑장 이용고객이 쉴 수 있는 공간이 있어 춥거나 더울 때 다용도로 사용가능하며 인접한 온천리조트 시설을 이용해도 무방하다. 참고로 글램핑장 이용고객에게는 ㈜신북리조트 50%할인권을 준다. 인원수에 상관없이 50%할인이 되니 캠핑과 함께 ㈜신북리조트의 온천, 사우나, 찜질방, 실내 바데 풀, 실외 파도 풀, 유수풀, 수영장 등의 다양한 시설을 이용해보자.","2024-05-09",,"",""
6289,"신화가족목공체험 캠핑소","여가활동","캠핑","자동차야영장","경기도","양평군","강상면","신화리","385 번지","강상로","326 번",37.4674,127.4691,"12572","경기도 양평군 강상면 강상로 326","경기도 양평군 강상면 신화리 385","031-775-7647","http://cafe.naver.com/shinhwacamp","민간","평일 운영","주말 운영","봄 운영","여름 운영","가을 운영","겨울 운영","전기 사용가능","온수 사용가능","wifi 사용불가","장작판매","산책로 없음","물놀이장 보유","놀이터 보유","마트 있음","2","1","1","15","낚시 시설없음","시설 주변 산책로 있음","시설 주변 물놀이(해수욕장) 없음","시설 주변 물놀이(수상레저) 없음","시설 주변 물놀이(계곡) 없음","시설 주변 물놀이(강) 없음","시설 주변 물놀이(수영장) 없음","시설 주변 물놀이(청소년체험시설) 있음","시설 주변 물놀이(농어촌체험시설) 없음","시설 주변 물놀이(어린이놀이시설) 없음","글램핑 침대 미보유","글램핑 TV 미보유","글램핑 냉장고 미보유","글램핑 유무선 인터넷 미보유","글램핑 내부화장실 미보유","글램핑 에어컨 미보유","글램핑 난방기 미보유","글램핑 취사도구 미보유","개인 트레일러 입장가능, 반려동물 동반 소형견만 가능","알수없음","2024-05-09",,"",""
